{"type":"game-analysis","version":1,"id":"dead-space-interconnected-tension-analysis","game":"Dead Space","build":"Motive remake developer features","platform":"PlayStation 5, Xbox Series X|S, PC","status":"OBSERVED","scope":["interconnected ship","revisitation","room-to-room tension","environmental variation","adaptive pacing"],"observations":["Motive describes the Ishimura as fully interconnected and traversable without camera cuts or load screens except death.","Completed locations can be revisited for missed items, new navigation paths, and new challenges.","The Intensity Director monitors room-to-room intensity and layers audio, lighting, fog, steam, and enemy events from a large event set."],"inferences":["A continuous spatial model makes revisitation and environmental memory reinforce each other.","Exploration tension needs pressure and release variation; constant threat becomes predictable noise rather than sustained fear."],"mechanic_ids":["spatial-landmark-legibility","knowledge-gated-revisitation"],"sources":["https://www.ea.com/en-gb/news/inside-dead-space-1-remaking-a-classic","https://www.ea.com/en-gb/inside-ea/news/inside-dead-space-4-the-intensity-director"],"limits":["Developer features describe implementation intent but do not expose the complete pacing algorithm.","Atmosphere and fear remain player-dependent and require direct playtesting."],"supersedes":null,"updated":"2026-08-11"}
