{"type":"game-analysis","version":1,"id":"dead-space-sensory-atmosphere-interface-analysis","game":"Dead Space franchise","build":"Official EA developer features and UI interview","platform":"Console and PC lineage","status":"OBSERVED","scope":["dynamic lighting","layered tension events","world-integrated UI","audio atmosphere","room pacing"],"observations":["Motive layers audio, lighting, fog, steam, and enemy events through the Intensity Director.","Lighting alternates limited visibility and threatening shadow while remaining dynamically unreliable.","Dead Space interface work embeds weapon selection, inventory, switches, and screens as holographic interactions inside the environment."],"inferences":["Atmosphere is a coordinated state across channels rather than a post-process filter.","Diegetic presentation still needs an authoritative binding and readable fallback."],"mechanic_ids":["event-bound-feedback-orchestration","attention-and-uncertainty-lighting","world-integrated-interface","spatial-information-audio"],"sources":["https://www.ea.com/en-gb/inside-ea/news/inside-dead-space-4-the-intensity-director","https://www.ea.com/news/breaking-into-the-industry-dino-ignacio-ui-lead-at-visceral-games"],"limits":["The public features do not expose full scheduling, mixing, or interface state architecture.","Fear and readability require direct testing across displays and players."],"supersedes":null,"updated":"2026-08-11"}
