{"type":"game-analysis","version":1,"id":"ghost-of-tsushima-adaptive-score-analysis","game":"Ghost of Tsushima","build":"Sony Interactive Entertainment GDC presentation","platform":"PlayStation 4 production lineage","status":"OBSERVED","scope":["adaptive music","open-world exploration score","interactive arrangement","production pipeline"],"observations":["Sony's music team describes a unique adaptive system as the score's backbone.","The implementation addresses more than forty hours of open-world gameplay and exploration music.","The presentation separates production, creative arrangement, and in-game implementation concerns."],"inferences":["Long exploration requires musical state and transition logic that can avoid obvious loops and binary combat switching.","Composition and runtime implementation must be designed together."],"mechanic_ids":["adaptive-music-state","event-bound-feedback-orchestration"],"sources":["https://www.gdcvault.com/play/1026983/Scoring-the-Open-World-Samurai"],"limits":["The session overview establishes scope but not all technical details.","Emotional effect requires direct comparative playtesting."],"supersedes":null,"updated":"2026-08-11"}
