{"type":"game-analysis","version":1,"id":"doom-enemy-boss-difficulty-analysis","game":"DOOM Eternal","build":"Official enemy, boss, Master Level, and update documentation","platform":"Cross-platform","status":"OBSERVED","scope":["enemy counterknowledge","boss phases","encounter remix","difficulty separation","optional challenge"],"observations":["Official guidance emphasizes learning enemy-specific defeat rules and readable attack openings.","The Gladiator's second phase preserves counter timing while adding attacks and spatial constraints.","Master Levels remix existing campaign spaces for players who mastered the fundamentals while still scaling to a separately chosen difficulty.","Update 6 separates arsenal reacquisition, extra-life permadeath, and Ultra-Nightmare permadeath into explicit challenge modes."],"inferences":["Enemy knowledge, encounter composition, resource availability, and persistence are independent difficulty axes.","A later boss phase can escalate by recombining established feedback rather than hiding new rules."],"mechanic_ids":["enemy-role-differentiation","boss-phase-teach-and-recombine","decision-transforming-difficulty"],"sources":["https://slayersclub.bethesda.net/en-US/article/designing-demons-noclip","https://slayersclub.bethesda.net/pt-BR/article/doom-eternal-boss-tips","https://slayersclub.bethesda.net/en-NZ/article/doom-eternal-master-levels","https://slayersclub.bethesda.net/en-US/article/doom-eternal-next-gen-update-6-release-notes"],"limits":["Official guidance does not expose the full AI or encounter-selection implementation.","Published challenge descriptions do not establish preference or fairness for every player."],"supersedes":null,"updated":"2026-08-11"}
