{"type":"game-analysis","version":1,"id":"destiny-reward-economy-analysis","game":"Destiny 2","build":"Official economy and Edge of Fate reward records","platform":"Cross-platform service rules","status":"OBSERVED","scope":["knockout rewards","power tiers","currency sources","sinks","caps","retirement"],"observations":["Nightfall weapons use a knockout list until the declared set is unlocked, then use flat drop chances.","Activity grade changes reward tier and Prime Engram chance.","Material sources, purchase paths, stack caps, and intended anti-hoarding behavior have been documented.","Removed currencies caused related focusing costs and obsolete material handling to change."],"inferences":["Reward probability, collection breadth, power progression, and currency value are separate states that should not be compressed into one rarity label.","Economy retirement must update inventories, costs, interfaces, and explanations together."],"mechanic_ids":["reward-pool-progression","currency-purpose-and-sinks","pickup-state-confirmation"],"sources":["https://origin-static01.bungie.net/7/en/News/Article/twid_07_03_2025","https://www.bungie.net/7/en/News/article/48198"],"limits":["Official posts state rules but do not publish full probability telemetry or player-retention causality.","Later live-service updates can supersede these bounded observations."],"supersedes":null,"updated":"2026-08-11"}
