{"type":"game-analysis","version":1,"id":"majoras-mask-resident-schedule-analysis","game":"The Legend of Zelda: Majora's Mask 3D","build":"Official Nintendo product description","platform":"Nintendo 3DS","status":"OBSERVED","scope":["resident schedules","intertwining paths","repeated perspectives","time-bound information","mask relationships"],"observations":["Nintendo describes characters living their final days independently along separate but intertwining paths.","Repeating the final days lets the player gather information, learn routines, arrive at specific times, and help different citizens.","Masks change abilities and which characters can be engaged."],"inferences":["Residents become parts of a temporal narrative system when their testimony and behavior are bound to scheduled state.","Repetition reveals perspectives without requiring every character to know the complete event."],"mechanic_ids":["recurring-landmark-narrative-mutation","situated-evidence-fragment","conflict-preserving-narrative-ledger"],"sources":["https://www.nintendo.com/au/games/nintendo-3ds/the-legend-of-zelda-majoras-mask-3d/","https://www.nintendo.com/en-gb/Games/Nintendo-64/The-Legend-of-Zelda-Majora-s-Mask-269525.html"],"limits":["Official summaries do not document every schedule dependency or journal behavior.","This analysis does not treat every resident statement as fact."],"supersedes":null,"updated":"2026-08-11"}
