{"type":"game-analysis","version":1,"id":"luigis-mansion-searchable-hotel-analysis","game":"Luigi's Mansion 3","build":"Official Nintendo gameplay and guidance","platform":"Nintendo Switch","status":"OBSERVED","scope":["themed floor identity","suspicious spaces","hidden objects","tool-gated discovery","treasure and gallery collection"],"observations":["Each major hotel floor uses a distinct theme and associated traversal, puzzle, trap, and enemy motifs.","Nintendo directs players to investigate suspicious areas and documents visual cues for traps.","The Dark Light reveals invisible furniture, money, power-ups, and hidden-room doors under a consistent tool rule.","Rare ghosts contribute to a persistent gallery collection."],"inferences":["Strong room themes can support both orientation and expectations about interactions.","A discovery tool remains meaningful when observation identifies where and why to use it."],"mechanic_ids":["spatial-landmark-legibility","learnable-secret-language","collection-ledger-completion"],"sources":["https://www.nintendo.com/jp/ichikara/ag3ja/index_en.html","https://play.nintendo.com/news-tips/tips-tricks/scarescraper-tips-and-tricks/","https://luigismansion3.nintendo.com/"],"limits":["Official guidance can make clue rules more explicit than blind first-play experience.","ScareScraper and story mode use different procedural and progression constraints."],"supersedes":null,"updated":"2026-08-11"}
