{"type":"game-analysis","version":1,"id":"dark-souls-bonfire-retry-analysis","game":"Dark Souls Remastered","build":"Official Bandai Namco product description","platform":"Remastered multi-platform version","status":"OBSERVED","scope":["bonfire checkpoint","world traversal","death consequence","recovery route","mastery"],"observations":["Bonfires divide traversal and recovery through an interconnected hostile world.","Death repeats a route with recoverable value exposed to further loss.","Enemy placement and route knowledge let a later attempt become faster or safer without removing execution."],"inferences":["Checkpoint distance is part of encounter structure because it sets the amount of solved material repeated before the failed point.","Recoverable loss can create a new route decision, but only while recovery remains realistically possible."],"mechanic_ids":["focused-retry-boundary","death-state-partition","knowledge-bearing-repetition"],"sources":["https://en.bandainamcoent.eu/dark-souls/dark-souls-remastered"],"limits":["The product page does not specify every death and recovery edge case.","Claims about learning require direct build observation and player reports."],"supersedes":null,"updated":"2026-08-11"}
