{"type":"game-analysis","version":1,"id":"osrs-collection-reward-analysis","game":"Old School RuneScape","build":"Collection Log and reward updates through 2026-08-11","platform":"Shared service state","status":"OBSERVED","scope":["collection log","rare drops","drop tables","slot totals","retroactive eligibility"],"observations":["The Collection Log records eligible discoveries as persistent slots grouped by content.","Official updates have corrected slot totals and added retroactive unlocks for eligible ownership.","Published drop tables separate guaranteed resources, unique-table rolls, and much rarer cosmetic outcomes.","A collection entry records acquisition but does not itself change the documented drop probability."],"inferences":["Visible completion can give repeated rare acquisition durable meaning without pretending to remove randomness.","Stable item identity and migration rules are as important as the presentation of completion totals."],"mechanic_ids":["collection-ledger-completion","reward-pool-progression","pickup-state-confirmation"],"sources":["https://oldschool.runescape.wiki/w/Update%3ABounty_Hunter_Changes%2C_Collection_Log_Updates_%26_Emote_Improvements","https://oldschool.runescape.wiki/w/Zulrah"],"limits":["The wiki is maintained collaboratively even where it archives official news and observed rates.","This record does not claim collection logging is sufficient protection against long dry streaks."],"supersedes":null,"updated":"2026-08-11"}
