{"type":"game-analysis","version":1,"id":"forza-motorsport-accessibility-feature-system-analysis","game":"Forza Motorsport","build":"Official accessibility support documentation","platform":"Xbox Series X|S and PC","status":"OBSERVED","scope":["blind driving assists","configurable driving assistance","audio cue identity","input alternatives","feature disclosure"],"observations":["Blind Driving Assists expose position, orientation, braking, turn, and track-limit information through configurable audio cues.","Cue pitch and volume can be configured independently rather than treating accessibility as one global mode.","The feature set coexists with broader driving assists and input configuration."],"inferences":["Equivalent access may require different information channels rather than identical presentation.","Independent settings need combination testing because a valid cue can be masked or contradicted by another configuration."],"mechanic_ids":["accessibility-equivalence-verification","spatial-information-audio","event-bound-feedback-orchestration"],"sources":["https://support.forzamotorsport.net/hc/en-us/articles/46524064744851-Forza-Motorsport-Accessibility-Support"],"limits":["Official documentation describes available behavior but does not prove equivalence for every player or setting combination.","Latency and reward identity require direct instrumented testing."],"supersedes":null,"updated":"2026-08-11"}
