{"type":"game-analysis","version":1,"id":"destiny-deep-stone-crypt-encounter-analysis","game":"Destiny 2: Deep Stone Crypt","build":"Official Bungie raid retrospective","platform":"Cross-platform live service","status":"OBSERVED","scope":["role switching","combat-puzzle composition","encounter teaching","coordination","raid rewards"],"observations":["Augment terminals let players switch declared encounter roles across the raid.","The first prolonged encounter combines enemy pressure, observation, coordination, and a security puzzle while previewing rules used later.","Shared spaces split the fireteam and force communication strategy.","Raid rewards are distributed across weapon slots and are intended to include items useful inside the raid."],"inferences":["Boss difficulty can come from role and information coordination rather than boss durability.","An early encounter can teach a mechanical language that later encounters recombine under pressure."],"mechanic_ids":["boss-phase-teach-and-recombine","decision-transforming-difficulty","enemy-role-differentiation"],"sources":["https://www.bungie.net/7/en/News/article/50141"],"limits":["Bungie's retrospective emphasizes intended structure and selected outcomes.","Six-player coordination cannot be assumed to transfer unchanged to solo combat."],"supersedes":null,"updated":"2026-08-11"}
