{"type":"game-analysis","version":1,"id":"destiny-layered-audio-identity-analysis","game":"Destiny 2","build":"Official Bungie audio developer diaries","platform":"Cross-platform live service","status":"OBSERVED","scope":["weapon identity","environment audio","sound-light synchronization","narrative audio","mix cohesion"],"observations":["Bungie distinguishes sound design from music and describes sound across the complete auditory experience.","Audio designers hand-place and coordinate details, including effects synchronized with light flicker and emission frequency.","Weapon audio begins from narrative and concept ideas and is coordinated with concept art, VFX, and technical constraints.","Lightfall audio production considers voices at distance, vendors, dialogue partners, music, and twelve localized languages as one coherent mix problem."],"inferences":["Sound identity should bind fiction, action, and feedback rather than decorate a completed mechanic.","Cross-channel cohesion needs explicit mix and priority constraints."],"mechanic_ids":["event-bound-feedback-orchestration","spatial-information-audio","adaptive-music-state"],"sources":["https://www.bungie.net/7/it/News/article/51457","https://www.bungie.net/7/pt-br/News/article/destiny-2-lightfall-music-doc"],"limits":["Developer diaries describe craft and examples rather than publish runtime mixing rules.","Localized and device-specific results require separate verification."],"supersedes":null,"updated":"2026-08-11"}
