{"type":"game-analysis","version":1,"id":"outer-wilds-environmental-mystery-analysis","game":"Outer Wilds","build":"Official Mobius Digital game description","platform":"Released multi-platform version","status":"OBSERVED","scope":["environmental mystery","ancient writing","changing locations","signals","hazard-bound secrets"],"observations":["The solar system changes with time and exposes locations under different physical conditions.","The player uses a translator, signal scope, probe, photographs, and environmental testing to gather evidence.","Ruins, signals, riddles, hazards, and planetary processes distribute the mystery across multiple places."],"inferences":["Narrative reconstruction strengthens when evidence must be related across location, source, and time.","A changing environment can operate as both story record and access rule."],"mechanic_ids":["situated-evidence-fragment","environmental-causal-trace","recurring-landmark-narrative-mutation"],"sources":["https://www.mobiusdigitalgames.com/outer-wilds.html"],"limits":["The official page establishes tools and world structure but does not enumerate the complete clue graph.","Claims about player inference require direct play observation."],"supersedes":null,"updated":"2026-08-11"}
