{"type":"game-analysis","version":1,"id":"tears-of-the-kingdom-exploration-analysis","game":"The Legend of Zelda: Tears of the Kingdom","build":"Official Ask the Developer Vol. 9 and product documentation","platform":"Nintendo Switch","status":"OBSERVED","scope":["landscape reinterpretation","cave entrances","vertical layers","shortcuts","player-authored routes"],"observations":["Developers describe adding valuable cave entrances to formerly bare cliff faces so one discovery changes how players inspect other cliffs.","The world connects surface, sky, and underground layers rather than treating each as an unrelated selection screen.","Ascend converts ceilings, hillsides, and some other overhead geometry into potential shortcuts."],"inferences":["A useful environmental difference can teach a reusable exploration question rather than merely contain one reward.","New movement rules are strongest when they alter how familiar geometry is read."],"mechanic_ids":["spatial-landmark-legibility","learnable-secret-language","knowledge-gated-revisitation"],"sources":["https://www.nintendo.com/us/whatsnew/ask-the-developer-vol-9-the-legend-of-zelda-tears-of-the-kingdom-part-3/","https://www.nintendo.com/us/store/products/the-legend-of-zelda-tears-of-the-kingdom-switch/"],"limits":["Developer explanation establishes intent and examples, not universal player response.","This bounded record does not evaluate the complete world or every cave reward."],"supersedes":null,"updated":"2026-08-11"}
