{"type":"game-analysis","version":1,"id":"majoras-mask-reset-analysis","game":"The Legend of Zelda: Majora's Mask 3D","build":"Nintendo 3DS electronic manual lineage","platform":"Nintendo 3DS","status":"OBSERVED","scope":["time reset","retained knowledge","scheduled world","item-state distinction","route compression"],"observations":["The game structures action within a repeating three-day period.","Returning to the first day resets scheduled world events while selected progression and player knowledge remain useful.","Learning where and when events occur lets later cycles compress routes and solve dependencies."],"inferences":["A reset can enlarge agency when the schedule is consistent enough to be learned.","The important retained state includes the player's temporal model, not only inventory flags."],"mechanic_ids":["death-state-partition","knowledge-bearing-repetition","focused-retry-boundary"],"sources":["https://www.nintendo.com/eu/media/downloads/games_8/emanuals/nintendo_3ds_2/the_legend_of_zelda_majoras_mask_3d/ElectronicManual_Nintendo3DS_TheLegendOfZeldaMajorasMask3D_EN.pdf"],"limits":["This is a time-reset loop rather than a death-only loop.","Manual documentation establishes rules but not individual emotional response."],"supersedes":null,"updated":"2026-08-11"}
