{"type":"game-analysis","version":1,"id":"dead-space-ishimura-environmental-story-analysis","game":"Dead Space","build":"Motive remake developer article","platform":"PlayStation 5, Xbox Series X|S, and PC","status":"OBSERVED","scope":["ship as character","functional spaces","signage","corporate history","interconnected revisitation"],"observations":["Motive describes the Ishimura as a main character and a microcosm of the wider setting.","Customs warnings, declarations, scanning stations, advertisements, posters, lighting, paneling, and room function are used to make the ship coherent and lived in.","The rebuilt ship is interconnected and permits revisiting completed spaces for missed content."],"inferences":["Environmental narrative is strongest when the room's practical purpose and historical traces agree.","Revisitation can reveal both spatial continuity and changed threat context."],"mechanic_ids":["environmental-causal-trace","situated-evidence-fragment","recurring-landmark-narrative-mutation"],"sources":["https://www.ea.com/en-gb/inside-ea/news/inside-dead-space-3-aboard-the-ishimura","https://www.ea.com/en-gb/news/inside-dead-space-1-remaking-a-classic"],"limits":["Developer statements describe intent and production choices, not a controlled player-response result.","Specific prop interpretations require direct scene capture."],"supersedes":null,"updated":"2026-08-11"}
